<?xml version="1.0" encoding="UTF-8"?>
<p:vuelo xmlns:p="http://www.edreams.com"
	xmlns:xsi="http://www.w3.org/2001/XMLSchema-instance"
	xsi:schemaLocation="http://www.edreams.com vueloSchema_ns.xsd ">
	<billete id="0">
		<trayecto>
			<origen>origen</origen>
			<destino did="">destino</destino>
			<ida />
		</trayecto>
		<fecha>
			<salida>2001-01-01</salida>
			<regreso>2001-01-01</regreso>
		</fecha>
		<pasajeros>
			<adultos>1</adultos>
			<niÃ±os>0</niÃ±os>
			<bebes>0</bebes>
		</pasajeros>
		<clase>turista barata</clase>
	</billete>
</p:vuelo>
